{
  "engine" : {
    "contract" : "1.57.0",
    "package" : "mlx-engine-swift",
    "version" : "0.72.0"
  },
  "executable" : "gaea-demo-worker",
  "helpers" : [
    {
      "model" : "demo-matmul",
      "operation" : "x-gaea.demo.matmul",
      "params" : {
        "additionalProperties" : false,
        "properties" : {
          "holdBytes" : {
            "default" : 0,
            "minimum" : 0,
            "type" : "integer"
          },
          "iterations" : {
            "default" : 10,
            "maximum" : 1000,
            "minimum" : 1,
            "type" : "integer"
          },
          "n" : {
            "default" : 4096,
            "maximum" : 16384,
            "minimum" : 16,
            "type" : "integer"
          }
        },
        "type" : "object"
      },
      "summary" : "n×n fp32 matmul, repeated; holds holdBytes to exercise the memory ledger.",
      "title" : "Matmul smoke test"
    }
  ],
  "id" : "com.xocialize.gaea.demo",
  "license" : "Apache-2.0",
  "manifest_version" : 1,
  "min_gaea" : "0.1.0",
  "models" : [
    {
      "id" : "demo-matmul",
      "lanes" : [
        {
          "default" : true,
          "id" : "fp32",
          "resolved" : {
            "capabilities" : [

            ],
            "contractVersion" : {
              "major" : 1,
              "minor" : 57,
              "patch" : 0
            },
            "footprintQuant" : "fp32",
            "materialization" : "bundled",
            "peakTransientBytes" : 2370000000,
            "peakTransientSource" : "largestThatFits",
            "persistentBytes" : 0,
            "persistentSource" : "largestThatFits",
            "selfMaterializing" : false,
            "weightSources" : [

            ]
          }
        }
      ],
      "package" : {
        "contractVersion" : {
          "major" : 1,
          "minor" : 57,
          "patch" : 0
        },
        "license" : {
          "portCodeLicense" : {
            "identifier" : "Apache-2.0"
          },
          "weightLicense" : {
            "identifier" : "Apache-2.0"
          }
        },
        "provenance" : {
          "revision" : "0.2.0",
          "sourceRepo" : "xocialize/gaea-plugin-demo",
          "tier" : 1
        },
        "requirements" : {
          "footprints" : [
            {
              "peakActivationBytes" : 2370000000,
              "quant" : "fp32",
              "residentBytes" : 0
            }
          ],
          "os" : {

          },
          "requiredBackends" : [
            "metalGPU"
          ]
        },
        "specialties" : [

        ],
        "surfaces" : [

        ]
      },
      "title" : "Demo matmul (GPU smoke test)"
    }
  ],
  "offers" : [

  ],
  "protocol" : 1,
  "repo" : "https://github.com/xocialize/gaea-plugin-demo",
  "settings" : [

  ],
  "summary" : "A GPU matmul loop that proves the plugin path end to end: download, verify, launch, run, cancel.",
  "team" : "CFZS6RXUCP",
  "title" : "Gaea demo worker",
  "version" : "0.2.0"
}
